{
  "schema_version": "1.0",
  "provenance": {
    "collected_at": "2026-08-06T15:30:00Z",
    "collector": "spo-collector",
    "collector_version": "0.3.0",
    "source_system": "SharePoint Online",
    "source_api": "PnP.PowerShell / CSOM",
    "tenant_id": "contoso.sharepoint.com",
    "identity_kind": "delegated",
    "scopes": [
      "AllSites.Read"
    ]
  },
  "coverage": {
    "requested": [
      "activity"
    ],
    "completed": [
      "activity"
    ],
    "unavailable": {}
  },
  "resource": {
    "id": "contoso,site,stale",
    "type": "site",
    "display_name": "Training Boost",
    "url": "https://contoso.sharepoint.com/sites/stale"
  },
  "facts": {
    "activity": {
      "last_user_modified": {
        "state": "observed",
        "value": "2025-05-23T13:22:48Z",
        "raw": {
          "field": "LastItemUserModifiedDate",
          "value": "2025-05-23T13:22:48Z"
        }
      },
      "last_item_modified": {
        "state": "observed",
        "value": "2026-08-06T15:30:33Z",
        "raw": {
          "field": "LastItemModifiedDate",
          "value": "2026-08-06T15:30:33Z"
        }
      },
      "created": {
        "state": "observed",
        "value": "2024-02-01T09:00:00Z",
        "raw": {
          "field": "Created",
          "value": "2024-02-01T09:00:00Z"
        }
      },
      "days_since_user_change": {
        "state": "observed",
        "value": 440,
        "raw": {
          "field": "LastItemUserModifiedDate vs collected_at",
          "value": 440
        }
      },
      "lock_state": {
        "state": "observed",
        "value": "Unlock",
        "raw": {
          "field": "LockState",
          "value": "Unlock"
        }
      },
      "archive_status": {
        "state": "observed",
        "value": "NotArchived",
        "raw": {
          "field": "ArchiveStatus",
          "value": "NotArchived"
        }
      },
      "changeable": {
        "state": "observed",
        "value": true,
        "raw": {
          "field": "LockState + ArchiveStatus",
          "value": true
        }
      }
    }
  }
}
