{
  "schema_version": "1.0",
  "provenance": {
    "collected_at": "2026-08-06T09:00:00Z",
    "collector": "spo-collector",
    "collector_version": "0.3.0",
    "source_system": "SharePoint Online",
    "source_api": "PnP.PowerShell / SharePoint Admin",
    "tenant_id": "contoso-admin.sharepoint.com",
    "identity_kind": "application",
    "scopes": [
      "Sites.Read.All"
    ]
  },
  "coverage": {
    "requested": [
      "site"
    ],
    "completed": [
      "site"
    ],
    "unavailable": {}
  },
  "resource": {
    "id": "contoso,site,archive-store",
    "type": "site",
    "display_name": "Archive Store",
    "url": "https://contoso.sharepoint.com/sites/archive-store"
  },
  "facts": {
    "site": {
      "storage_used_mb": {
        "state": "observed",
        "value": 24100,
        "raw": {
          "field": "StorageUsageCurrent",
          "value": 24100
        }
      },
      "storage_quota_mb": {
        "state": "observed",
        "value": 25600,
        "raw": {
          "field": "StorageQuota",
          "value": 25600
        }
      },
      "storage_used_percent": {
        "state": "observed",
        "value": 94,
        "raw": {
          "field": "StorageUsageCurrent/StorageQuota",
          "value": 94
        }
      }
    }
  }
}
