{
  "schema_version": "1.0",
  "provenance": {
    "collected_at": "2026-08-06T09:00:00Z",
    "collector": "spo-collector",
    "collector_version": "0.3.0",
    "source_system": "SharePoint Online",
    "source_api": "PnP.PowerShell / SharePoint Admin",
    "tenant_id": "contoso-admin.sharepoint.com",
    "identity_kind": "application",
    "scopes": [
      "Sites.Read.All"
    ]
  },
  "coverage": {
    "requested": [
      "owners"
    ],
    "completed": [
      "owners"
    ],
    "unavailable": {}
  },
  "resource": {
    "id": "contoso,site,finance-ops",
    "type": "site",
    "display_name": "Finance Ops",
    "url": "https://contoso.sharepoint.com/sites/finance-ops"
  },
  "facts": {
    "owners": {
      "state": "observed",
      "direct": [
        {
          "principal_id": "user-0",
          "principal_type": "user"
        },
        {
          "principal_id": "user-1",
          "principal_type": "user"
        }
      ],
      "groups": [
        {
          "principal_id": "group-0",
          "principal_type": "group",
          "expansion": {
            "status": "not-attempted"
          }
        }
      ],
      "direct_count": {
        "state": "observed",
        "value": 2,
        "raw": {
          "field": "PrincipalType",
          "value": 2
        }
      },
      "group_count": {
        "state": "observed",
        "value": 1,
        "raw": {
          "field": "PrincipalType",
          "value": 1
        }
      },
      "expansion_complete": false,
      "minimum_count": 2
    }
  }
}
