{
  "schema_version": "1.0",
  "provenance": {
    "collected_at": "2026-08-06T16:55:00Z",
    "collector": "spo-collector",
    "collector_version": "0.10.0",
    "source_system": "SharePoint Online",
    "source_api": "PnP.PowerShell / CSOM",
    "tenant_id": "contoso.sharepoint.com",
    "identity_kind": "delegated",
    "scopes": [
      "AllSites.Read"
    ]
  },
  "coverage": {
    "requested": [
      "classification"
    ],
    "completed": [
      "classification"
    ],
    "unavailable": {}
  },
  "resource": {
    "id": "contoso,site,group-unlabelled",
    "type": "site",
    "display_name": "All Company",
    "url": "https://contoso.sharepoint.com/sites/allcompany"
  },
  "facts": {
    "classification": {
      "label_applied": {
        "state": "observed",
        "value": false,
        "raw": {
          "field": "SensitivityLabelInfo.Id",
          "value": false
        }
      },
      "label_id": {
        "state": "missing",
        "detail": "No sensitivity label is applied to this site, so there is no id to report."
      },
      "label_name": {
        "state": "missing",
        "detail": "No sensitivity label is applied, so there is no name to resolve."
      },
      "label_resolved": {
        "state": "missing",
        "detail": "No label is applied, so there is nothing to resolve."
      },
      "classification_set": {
        "state": "observed",
        "value": false,
        "raw": {
          "field": "Classification",
          "value": false
        }
      },
      "site_classification": {
        "state": "missing",
        "detail": "No classification string is set on this site."
      },
      "group_connected": {
        "state": "observed",
        "value": true,
        "raw": {
          "field": "GroupId",
          "value": true
        }
      },
      "group_id": {
        "state": "observed",
        "value": "7c9a1f2e-3b44-4d05-9f21-6ea8c0d13b77",
        "raw": {
          "field": "GroupId",
          "value": "7c9a1f2e-3b44-4d05-9f21-6ea8c0d13b77"
        }
      },
      "teams_connected": {
        "state": "not-supported",
        "detail": "IsTeamsConnected is a property of the tenant record, and this mode reads the site. See group_connected, which is observable without administrative rights."
      },
      "classified": {
        "state": "observed",
        "value": false,
        "raw": {
          "field": "SensitivityLabelInfo.Id or Classification",
          "value": false
        }
      }
    }
  }
}
