{
  "schema_version": "1.0",
  "provenance": {
    "collected_at": "2026-08-05T14:02:11Z",
    "collector": "spo-collector",
    "collector_version": "0.1.0",
    "source_system": "SharePoint Online",
    "source_api": "PnP.PowerShell / CSOM",
    "tenant_id": "00000000-0000-0000-0000-000000000000",
    "identity_kind": "application",
    "scopes": [
      "Sites.Read.All"
    ]
  },
  "coverage": {
    "requested": [
      "owners"
    ],
    "completed": [
      "owners"
    ],
    "unavailable": {}
  },
  "resource": {
    "id": "contoso,site,finance",
    "type": "site",
    "display_name": "Finance",
    "url": "https://contoso.sharepoint.com/sites/Finance"
  },
  "facts": {
    "owners": {
      "state": "observed",
      "direct": [
        {
          "principal_id": "user-1",
          "principal_type": "user"
        },
        {
          "principal_id": "user-2",
          "principal_type": "user"
        }
      ],
      "groups": [],
      "expansion_complete": true,
      "effective_count": 2
    }
  }
}
