{
  "schema_version": "1.0",
  "provenance": {
    "collected_at": "2026-08-06T15:30:00Z",
    "collector": "spo-collector",
    "collector_version": "0.3.0",
    "source_system": "SharePoint Online",
    "source_api": "PnP.PowerShell / CSOM",
    "tenant_id": "contoso.sharepoint.com",
    "identity_kind": "delegated",
    "scopes": [
      "AllSites.Read"
    ]
  },
  "coverage": {
    "requested": [
      "activity"
    ],
    "completed": [
      "activity"
    ],
    "unavailable": {}
  },
  "resource": {
    "id": "contoso,site,unread",
    "type": "site",
    "display_name": "Unreadable",
    "url": "https://contoso.sharepoint.com/sites/unread"
  },
  "facts": {
    "activity": {
      "last_user_modified": {
        "state": "permission-denied",
        "detail": "The identity lacks the scope required to read the web."
      },
      "days_since_user_change": {
        "state": "permission-denied",
        "detail": "Derived from LastItemUserModifiedDate, which was not read."
      },
      "lock_state": {
        "state": "missing",
        "detail": "The tenant record for this site was not read. It was not requested: -TenantUrl was not given."
      },
      "archive_status": {
        "state": "missing",
        "detail": "The tenant record for this site was not read. It was not requested: -TenantUrl was not given."
      },
      "changeable": {
        "state": "missing",
        "detail": "Derived from LockState and ArchiveStatus, and one was not read."
      }
    }
  }
}
