{
  "schema_version": "1.0",
  "provenance": {
    "collected_at": "2026-08-05T14:02:11Z",
    "collector": "spo-collector",
    "collector_version": "0.1.0",
    "source_system": "SharePoint Online",
    "source_api": "Microsoft Graph v1.0",
    "tenant_id": "00000000-0000-0000-0000-000000000000",
    "identity_kind": "application",
    "scopes": [
      "Sites.Read.All"
    ]
  },
  "coverage": {
    "requested": [
      "owners"
    ],
    "completed": [],
    "unavailable": {
      "owners": {
        "state": "permission-denied",
        "detail": "The identity lacks Sites.FullControl.All"
      }
    }
  },
  "resource": {
    "id": "contoso,site,legal",
    "type": "site",
    "display_name": "Legal",
    "url": "https://contoso.sharepoint.com/sites/Legal"
  },
  "facts": {
    "owners": {
      "state": "permission-denied",
      "detail": "The identity lacks Sites.FullControl.All",
      "expansion_complete": false,
      "minimum_count": 0
    }
  }
}
