{
  "schema_version": "1.0",
  "provenance": {
    "collected_at": "2026-08-06T09:00:00Z",
    "collector": "spo-collector",
    "collector_version": "0.3.0",
    "source_system": "SharePoint Online",
    "source_api": "PnP.PowerShell / SharePoint Admin",
    "tenant_id": "contoso-admin.sharepoint.com",
    "identity_kind": "application",
    "scopes": [
      "Sites.Read.All"
    ]
  },
  "coverage": {
    "requested": [
      "sharing"
    ],
    "completed": [],
    "unavailable": {
      "sharing": {
        "state": "permission-denied",
        "detail": "The identity lacks the scope required to read sharing settings."
      }
    }
  },
  "resource": {
    "id": "contoso,site,unknown-sharing",
    "type": "site",
    "display_name": "Unknown Sharing",
    "url": "https://contoso.sharepoint.com/sites/unknown-sharing"
  },
  "facts": {
    "sharing": {
      "capability": {
        "state": "permission-denied",
        "detail": "The identity lacks the scope required to read sharing settings."
      },
      "default_link_type": {
        "state": "permission-denied",
        "detail": "The identity lacks the scope required to read sharing settings."
      }
    }
  }
}
